"text";"favorited";"favoriteCount";"replyToSN";"created";"truncated";"replyToSID";"id";"replyToUID";"statusSource";"screenName";"retweetCount";"isRetweet";"retweeted";"longitude";"latitude";"lastname"
"Wyslalem do Sejmu projekt zmian w Kodeksie wyborczym. Licze, ze wejda w zycie przed wyborami parlamentarnymi.";FALSE;4;NA;2015-04-02 17:51:12;FALSE;NA;583688142324129792;NA;<a href="http://twitter.com" rel="nofollow">Twitter Web Client</a>;Komorowski;3;FALSE;FALSE;NA;NA;"Komorowski"
"Wiadomo juz jak wygladac beda obchody rocznicy zakonczenia II wojny swiatowej w Polsce i kto sie na nich stawi. Odbeda sie 7 i 8 maja.";FALSE;4;NA;2015-04-02 17:46:26;FALSE;NA;583686944787402752;NA;<a href="http://twitter.com" rel="nofollow">Twitter Web Client</a>;Komorowski;3;FALSE;FALSE;NA;NA;"Komorowski"
"Zasada rozstrzygania watpliwosci na korzysc podatnika powinna stac sie podstawa systemu podatkowego.";FALSE;10;NA;2015-04-02 17:40:34;FALSE;NA;583685468530876416;NA;<a href="http://twitter.com" rel="nofollow">Twitter Web Client</a>;Komorowski;8;FALSE;FALSE;NA;NA;"Komorowski"
"Ksztaltowanie sie nowej instytucji dialogu spolecznego pokazuje, ze dialog znów zwycieza.";FALSE;2;NA;2015-04-02 17:37:01;FALSE;NA;583684573546053632;NA;<a href="http://twitter.com" rel="nofollow">Twitter Web Client</a>;Komorowski;3;FALSE;FALSE;NA;NA;"Komorowski"
"Dzis nie ma zadnych regulacji odnosnie in vitro. Wazne, aby wprowadzajac je uwzglednic rózne wrazliwosci.";FALSE;3;NA;2015-04-02 17:33:19;FALSE;NA;583683643702411264;NA;<a href="http://twitter.com" rel="nofollow">Twitter Web Client</a>;Komorowski;1;FALSE;FALSE;NA;NA;"Komorowski"
"Prezydent nie moze byc prezydentem sumien.";FALSE;10;NA;2015-04-02 17:31:26;FALSE;NA;583683170261950464;NA;<a href="http://twitter.com" rel="nofollow">Twitter Web Client</a>;Komorowski;8;FALSE;FALSE;NA;NA;"Komorowski"
"O 19:25 bede gosciem @faktypofaktach. Zapraszam. http://t.co/A3jnkNLYNp";FALSE;6;NA;2015-04-02 16:55:31;FALSE;NA;583674129288683522;NA;<a href="http://twitter.com" rel="nofollow">Twitter Web Client</a>;Komorowski;4;FALSE;FALSE;NA;NA;"Komorowski"
"@PrzemekTaranek Dziekuje i pozdrawiam:-) Zycze spokojnych i radosnych Swiat!";FALSE;0;PrzemekTaranek;2015-04-02 19:04:02;FALSE;583510110955298817;583706472359538688;2923675863;<a href="http://twitter.com/#!/download/ipad" rel="nofollow">Twitter for iPad</a>;AndrzejDuda;0;FALSE;FALSE;NA;NA;"Duda"
"@DawidGospodarek Odszkodowania powinien placic ten, kto wywolal wojne. To nie my ja wywolalismy, wiec o czym w ogóle mowa.";FALSE;1;DawidGospodarek;2015-04-02 18:33:31;FALSE;583696100428795904;583698791670358017;481166011;<a href="http://twitter.com/#!/download/ipad" rel="nofollow">Twitter for iPad</a>;AndrzejDuda;0;FALSE;FALSE;NA;NA;"Duda"
"Memento! http://t.co/vYs0suZJqL";FALSE;30;NA;2015-04-02 15:56:41;FALSE;NA;583659324502839296;NA;<a href="http://twitter.com/download/iphone" rel="nofollow">Twitter for iPhone</a>;AndrzejDuda;22;FALSE;FALSE;NA;NA;"Duda"
"@Pearljam6MM Nie. Publicznie przeprosilem tych Studentów, którzy ewentualnie odczuli dyskomfort. OK?";FALSE;1;Pearljam6MM;2015-04-02 15:19:06;FALSE;583648825614725121;583649866414424064;2850304133;<a href="http://twitter.com/download/iphone" rel="nofollow">Twitter for iPhone</a>;AndrzejDuda;0;FALSE;FALSE;NA;NA;"Duda"
"@Pearljam6MM @LeszekMiller @LejmanPawel I dlatego przeprosilem wczoraj. OK?";FALSE;0;Pearljam6MM;2015-04-02 15:08:48;FALSE;583645256211681280;583647274653392898;2850304133;<a href="http://twitter.com/download/iphone" rel="nofollow">Twitter for iPhone</a>;AndrzejDuda;0;FALSE;FALSE;NA;NA;"Duda"
"@MariuszGierej @agielewska @robertzielinski @maciejdudared I nie beda mogli pieprzyc ;-)))";FALSE;19;MariuszGierej;2015-04-02 14:38:32;FALSE;583639344470224896;583639658711666688;518863383;<a href="http://twitter.com/#!/download/ipad" rel="nofollow">Twitter for iPad</a>;AndrzejDuda;6;FALSE;FALSE;NA;NA;"Duda"
"@hdmortimer Takim Go zapamietalem z 2005 roku.";FALSE;2;hdmortimer;2015-04-02 14:31:35;FALSE;583637457381548032;583637907367448576;2232876144;<a href="http://twitter.com/#!/download/ipad" rel="nofollow">Twitter for iPad</a>;AndrzejDuda;0;FALSE;FALSE;NA;NA;"Duda"
"Red. Kolanko: Wadowice ostatnim przystankiem Dudy przed Wielkanoca, powrót kampanii we wtorek | News | 300polityka http://t.co/r3VLXPL6IO";FALSE;11;NA;2015-04-02 14:28:24;FALSE;NA;583637108914577408;NA;<a href="http://www.apple.com" rel="nofollow">iOS</a>;AndrzejDuda;6;FALSE;FALSE;NA;NA;"Duda"
"@SmithBober Wzajemnie! :-)";FALSE;0;SmithBober;2015-04-02 14:26:53;FALSE;583635287449989120;583636727157358592;1681360915;<a href="http://twitter.com/#!/download/ipad" rel="nofollow">Twitter for iPad</a>;AndrzejDuda;0;FALSE;FALSE;NA;NA;"Duda"
"@Jaroslaw_Gowin @marek_podolski @hdmortimer @ChrisForger Ktos posluchal, stad afery zegarkowe;-)))";FALSE;5;Jaroslaw_Gowin;2015-04-02 14:15:24;FALSE;583633583757250560;583633835092480000;580682368;<a href="http://twitter.com/download/iphone" rel="nofollow">Twitter for iPhone</a>;AndrzejDuda;1;FALSE;FALSE;NA;NA;"Duda"
"@Jaroslaw_Gowin A moze wlasnie dorastamy? Pozdrawiam swiatecznie! :-)";FALSE;19;Jaroslaw_Gowin;2015-04-02 14:13:11;FALSE;583533379171266560;583633276310532097;580682368;<a href="http://twitter.com/download/iphone" rel="nofollow">Twitter for iPhone</a>;AndrzejDuda;2;FALSE;FALSE;NA;NA;"Duda"
"@PrzemekTaranek @RadioZET_NEWS Ale warto zaznaczyc, ze podpis to nie glos tylko szansa dla kandydata na start wyborach. A to jednak róznica.";FALSE;2;AndrzejDuda;2015-04-01 23:37:51;FALSE;583412357235400704;583412993838419971;202086424;<a href="http://twitter.com/#!/download/ipad" rel="nofollow">Twitter for iPad</a>;AndrzejDuda;0;FALSE;FALSE;NA;NA;"Duda"
"@PrzemekTaranek @RadioZET_NEWS Dlatego przeprosilem przez media dzis wszystkich Tych, którzy ewentualnie odczuli dyskomfort.";FALSE;8;PrzemekTaranek;2015-04-01 23:35:19;FALSE;583190430084390912;583412357235400704;2923675863;<a href="http://twitter.com/#!/download/ipad" rel="nofollow">Twitter for iPad</a>;AndrzejDuda;3;FALSE;FALSE;NA;NA;"Duda"
"Poletko Pana P - Robert Leszczynski http://t.co/G52HZeF0hV";FALSE;9;NA;2015-04-02 07:47:55;FALSE;NA;583536324117946368;NA;<a href="http://twitter.com" rel="nofollow">Twitter Web Client</a>;Palikot_Janusz;1;FALSE;FALSE;NA;NA;"Palikot"
"Spotkanie w Plocku. Dziekuje za dobra energie i entuzjazm! http://t.co/rNASgrb1qR";FALSE;2;NA;2015-04-02 17:35:33;FALSE;NA;583684207211347968;NA;<a href="http://www.apple.com" rel="nofollow">iOS</a>;JarubasAdam;1;FALSE;FALSE;NA;NA;"Jarubas"
"Ziemia Plocka na trasie kampanii. Swietna orkiestra mlodziezowa z Drobina. Bardzo dziekuje! http://t.co/RQ6qMwN9i1";FALSE;2;NA;2015-04-02 17:34:19;FALSE;NA;583683892965724160;NA;<a href="http://www.apple.com" rel="nofollow">iOS</a>;JarubasAdam;1;FALSE;FALSE;NA;NA;"Jarubas"
"Dzis Dzien Kaplanski. Wszystkim Kaplanom zycze nieustajacej wiary, nadziei i milosci w ich codziennej sluzbie Bogu i czlowiekowi.";FALSE;5;NA;2015-04-02 08:07:30;FALSE;NA;583541248746725376;NA;<a href="http://twitter.com/download/iphone" rel="nofollow">Twitter for iPhone</a>;JarubasAdam;3;FALSE;FALSE;NA;NA;"Jarubas"
"@Olua_AO Dopinamy z Centrum Adama Smith’a, po swietach prezentacja";FALSE;2;Olua_AO;2015-04-02 18:55:27;FALSE;583646720602542080;583704313505124352;2745415802;<a href="http://tapbots.com/software/tweetbot/mac" rel="nofollow">Tweetbot for Mac</a>;PrezydentKukiz;0;FALSE;FALSE;NA;NA;"Kukiz"
"Moja rozmowa z Wieslawem Debskim http://t.co/srwjJTEaqu";FALSE;4;NA;2015-04-02 18:51:40;FALSE;NA;583703362220249088;NA;<a href="http://tapbots.com/software/tweetbot/mac" rel="nofollow">Tweetbot for Mac</a>;PrezydentKukiz;5;FALSE;FALSE;NA;NA;"Kukiz"
"Najwazniejsze jest, zeby Polakom dac przekaz, ze trzeba zmienic ustrój, by jak pochodnie ten ogien niesli dalej. http://t.co/REUVkv9fHB";FALSE;15;NA;2015-04-02 13:26:04;FALSE;NA;583621421395484673;NA;<a href="http://tapbots.com/software/tweetbot/mac" rel="nofollow">Tweetbot for Mac</a>;PrezydentKukiz;4;FALSE;FALSE;NA;NA;"Kukiz"
"@jan_czapski Mieli prezydenta i  Senat czyli wszystko by rozpisac referendum. Oficjalne stanowisko: nie da sie http://t.co/0pVbebVnZB";FALSE;1;jan_czapski;2015-04-02 13:23:06;FALSE;583617798972256256;583620675019087872;3057616522;<a href="http://tapbots.com/software/tweetbot/mac" rel="nofollow">Tweetbot for Mac</a>;PrezydentKukiz;0;FALSE;FALSE;NA;NA;"Kukiz"
"@jan_czapski Ta opcja juz mi to kiedys obiecala, nie mam powodów dac sie znów oklamac.";FALSE;1;jan_czapski;2015-04-02 13:21:49;FALSE;583617798972256256;583620349130059776;3057616522;<a href="http://tapbots.com/software/tweetbot/mac" rel="nofollow">Tweetbot for Mac</a>;PrezydentKukiz;0;FALSE;FALSE;NA;NA;"Kukiz"
"Dzielenie skóry na niedzwiedziu. Czysto teoretycznie powiem, ze kazdy teoretyczny koalicjant musi byc gotowy na JOW http://t.co/TQISmMn0Tc";FALSE;3;NA;2015-04-02 12:54:18;FALSE;NA;583613426825564160;NA;<a href="http://tapbots.com/software/tweetbot/mac" rel="nofollow">Tweetbot for Mac</a>;PrezydentKukiz;2;FALSE;FALSE;NA;NA;"Kukiz"
"Wywiad dla Goscia Niedzielnego, dosc leciwy bo z 2009 r. ale chyba jeden z moich ulubionych http://t.co/tRQvP2aHlg";FALSE;2;NA;2015-04-02 12:18:30;FALSE;NA;583604417427046400;NA;<a href="http://tapbots.com/software/tweetbot/mac" rel="nofollow">Tweetbot for Mac</a>;PrezydentKukiz;3;FALSE;FALSE;NA;NA;"Kukiz"
"Mija 10. rocznica smierci sw. Jana Pawla II, dzis takze Wielki Czwartek - swieto kaplanów, szczesc Wam Boze! http://t.co/8dOSWafrzD";FALSE;10;NA;2015-04-02 20:07:53;FALSE;NA;583722539232452608;NA;<a href="http://twitter.com" rel="nofollow">Twitter Web Client</a>;M_Kowalski1;7;FALSE;FALSE;NA;NA;"Kowalski"
